Name,Address,Latitude,Longitude,Rating_Tabelog,Rating_Google,Tags,Summary,Station,Region,Thumbnail,Google_URL,Tabelog_URL,Created_At,Updated_At
函館活鮮居酒屋 魚和,北海道函館市松風町4-10,41.7713575,140.7313938,3.51,4.6,"🏆 현지인 인증맛집, 이자카야, 해산물, 스키야키, 하코다테, 카드 가능","하코다테역 인근에 위치한 이곳은 밝고 쾌적한 분위기에서 신선한 모둠 사시미, 털게, 소라회 등 고퀄리티의 홋카이도 해산물과 지역 특산인 '지모 두부' 요리를 즐길 수 있는 인기 이자카야입니다. 친절한 서비스와 가성비 좋은 게 요리, 생일 기념 디저트 서비스 등으로 현지인과 관광객 모두에게 만족도가 높으며 홋카이도산 사케와 함께 즐기기 좋습니다. 다만, 음식 메뉴의 가짓수가 아주 다양하지는 않고 활오징어 등 인기 재료가 일찍 소진될 수 있으며, 유명세로 인해 다소 소란스럽거나 예약이 필수적이라는 점은 참고해야 합니다.",🚇 JR 하코다테역에서 도보 10분,⛄ 홋카이도,https://tblg.k-img.com/resize/660x370c/restaurant/images/Rvw/303841/7538438388c5c1611ab1c0887ac1242e.jpg?token=d1069cb&api=v2,"https://www.google.com/maps/place/%E5%87%BD%E9%A4%A8%E6%B4%BB%E9%AE%AE%E5%B1%85%E9%85%92%E5%B1%8B+%E9%AD%9A%E5%92%8C+Uonagi/@41.7713575,140.7313938,17z/data=!3m1!4b1!4m6!3m5!1s0x5f9ef3f53b483773:0x1d6f26d4b3867cd2!8m2!3d41.7713575!4d140.7313938!16s%2Fg%2F11mcbrm8gq?entry=ttu&g_ep=EgoyMDI2MDIyNC4wIKXMDSoASAFQAw%3D%3D",https://tabelog.com/hokkaido/A0105/A010501/1080639/,2026-02-27,2026-02-27
FOREST DINER 札幌店,北海道札幌市中央区北三条西4-1D-LIFEPLACE 札幌 1F,43.0652311,141.3505952,3.4,4.4,"💡 숨겨진 맛집, 수제버거, 바(Bar), 다이닝 바, 주오구, 삿포로, 카드 가능, 간편결제 가능","'FOREST DINER 삿포로점'은 삿포로역 인근 지하도와 연결되어 접근성이 뛰어나며, 세련된 미국식 다이닝 바 분위기 속에서 화려한 거리 조명을 감상할 수 있는 곳입니다. 육즙 가득한 나카오치 스테이크, 독특한 우설 버거, 술과 잘 어울리는 나초 등이 인기 메뉴이며 전반적인 음식의 간과 안주 맛에 대한 만족도가 높습니다. 세련된 분위기와 맛깔스러운 요리는 장점이지만, 스테이크가 다소 질기거나 크래프트 맥주의 종류가 제한적일 수 있다는 점은 호불호가 갈리는 요소입니다. 또한 무제한 음료(노미호다이) 이용 시 가격이나 종료 시간이 메뉴판에 명확히 안내되지 않을 수 있으니 사전에 확인하는 것을 추천합니다.",🚇 札幌市営東豊線 삿포로역에서 도보 1분,⛄ 홋카이도,https://tblg.k-img.com/resize/660x370c/restaurant/images/Rvw/253091/507b3622e75bd794012b2fb4340ec447.jpg?token=2ab23eb&api=v2,"https://www.google.com/maps/place/FOREST+DINER+%E6%9C%AD%E5%B9%8C%E5%BA%97/@43.0652311,141.3505952,17z/data=!3m1!4b1!4m6!3m5!1s0x5f0b297735894783:0x14b37e1d9e070ddf!8m2!3d43.0652311!4d141.3505952!16s%2Fg%2F11vc6n5n2g?entry=ttu&g_ep=EgoyMDI2MDIyNC4wIKXMDSoASAFQAw%3D%3D",https://tabelog.com/hokkaido/A0101/A010101/1076342/,2026-02-27,2026-02-27
海鮮個室酒場 伊まり 時計台前店,北海道札幌市中央区北1条西3-3-25荒巻時計台ビル B1F,43.0628622,141.3523366,3.29,4.5,"💡 숨겨진 맛집, 이자카야, 해산물, 주오구, 삿포로, 카드 가능, 간편결제 가능","삿포로 시계탑 인근에 위치한 이 식당은 2시간 990엔의 저렴한 무제한 음료(노미호다이)와 가성비 좋은 해산물 코스 요리를 제공하는 개별실 이자카야입니다. 화려한 비주얼의 도미·소라 사시미 모둠과 굴 마츠마에야키가 인기 메뉴이며, 태블릿 주문 방식임에도 직원이 직접 음료 마감을 안내해 주는 세심한 서비스가 특징입니다. 전 좌석이 프라이빗한 개별실로 구성되어 조용히 대화하기 좋으나, 실내 흡연이 가능하여 흡연자에게는 매력적이지만 비흡연자에게는 호불호가 갈릴 수 있습니다.",🚇 삿포로역에서 도보 2분,⛄ 홋카이도,https://tblg.k-img.com/resize/660x370c/restaurant/images/Rvw/271754/5e06238ab854421eb37e79963fced518.jpg?token=5577c51&api=v2,"https://www.google.com/maps/place/%E6%B5%B7%E9%AE%AE%E5%80%8B%E5%AE%A4%E9%85%92%E5%A0%B4+%E4%BC%8A%E3%81%BE%E3%82%8A+%E6%99%82%E8%A8%88%E5%8F%B0%E5%89%8D%E5%BA%97/@43.0628622,141.3523366,17z/data=!3m1!4b1!4m6!3m5!1s0x5f0b293accc8f0a9:0x92e23ce7ea86b30a!8m2!3d43.0628622!4d141.3523366!16s%2Fg%2F11vz7dh0gt?entry=ttu&g_ep=EgoyMDI2MDIyNS4wIKXMDSoASAFQAw%3D%3D",https://tabelog.com/hokkaido/A0101/A010101/1078529/,2026-03-02,2026-03-02
だし劇場 ○△□ すすきの駅前店,北海道札幌市中央区南四条西2-11-7TOMORUビル 8F,43.0562657,141.3555497,3.55,4.1,"🏆 현지인 인증맛집, 이자카야, 해산물, 주오구, 삿포로, 카드 가능","삿포로 스스키노 역 인근에 위치한 이곳은 고품질의 **'오뎅 무한 리필'**이 기본 안주(오토시)로 제공되는 점이 가장 큰 특징이자 인기 요인입니다. 밝고 활기찬 분위기 속에 친절한 서비스와 **다양한 사케 라인업**을 갖추고 있어 술을 즐기기에 좋으며, 매장 입구가 귀엽고 접근성이 뛰어나다는 평을 받습니다. 음식의 맛과 오뎅의 퀄리티는 훌륭하지만, 가격대가 다소 높고 안주 메뉴의 가짓수가 아주 다양하지는 않다는 점이 아쉬운 부분으로 꼽힙니다. 전체적으로 육수 맛이 깊은 오뎅을 마음껏 즐길 수 있다는 강력한 장점 덕분에 눈보라 속에서도 손님이 붐비는 인기 맛집입니다.",🚇 호스이스스키노역에서 도보 1분,⛄ 홋카이도,https://tblg.k-img.com/resize/660x370c/restaurant/images/Rvw/307797/75926b9878cb8da35cce5a91c4fe8bd8.jpg?token=cca7ec7&api=v2,"https://www.google.com/maps/place/%E3%81%A0%E3%81%97%E5%8A%87%E5%A0%B4%E3%80%87%E2%96%B3%E2%96%A1+%E3%81%99%E3%81%99%E3%81%8D%E3%81%AE%E9%A7%85%E5%89%8D%E5%BA%97/@43.0562657,141.3529748,17z/data=!3m1!4b1!4m6!3m5!1s0x5f0b29d0ef595597:0x18b75d4ca1ff27a2!8m2!3d43.0562657!4d141.3555497!16s%2Fg%2F11whtwr_qf?entry=ttu&g_ep=EgoyMDI2MDIyNS4wIKXMDSoASAFQAw%3D%3D",https://tabelog.com/hokkaido/A0101/A010102/1078823/,2026-03-02,2026-03-02
個室居酒屋 和菜美 札幌駅前店,北海道札幌市中央区北4条西6-1-1エターナルパンセ 3F,43.065573,141.3469139,3.54,4.3,"🏆 현지인 인증맛집, 이자카야, 해산물, 나베, 주오구, 삿포로, 카드 가능","삿포로역 인근에 위치한 이 식당은 깔끔한 목재 인테리어와 프라이빗한 개별실을 갖추고 있어, 도심 속에서도 차분하고 세련된 분위기를 즐길 수 있는 이자카야입니다. 신선한 해산물과 정갈한 정통 일식 메뉴가 인기이며, 역과의 뛰어난 접근성 덕분에 퇴근길 직장인부터 여행객까지 다양한 손님들이 즐겨 찾습니다. 신규 매장 특유의 청결함과 매끄러운 서비스가 큰 장점으로 꼽혀 기념일이나 모임 장소로 적합하지만, 인기 업장인 만큼 저녁 시간대에는 다소 붐빌 수 있습니다.",🚇 삿포로역에서 도보 1분,⛄ 홋카이도,https://tblg.k-img.com/resize/660x370c/restaurant/images/Rvw/258451/633d8faf7e445a3529332ed1e6fb5354.jpg?token=d4af201&api=v2,"https://www.google.com/maps/place/%E5%92%8C%E8%8F%9C%E7%BE%8E+%E6%9C%AD%E5%B9%8C%E9%A7%85%E5%89%8D%E5%BA%97/@43.065573,141.3469139,17z/data=!3m1!4b1!4m6!3m5!1s0x5f0b29d11de2b6bf:0x1f779eeecf326355!8m2!3d43.065573!4d141.3469139!16s%2Fg%2F11jvq_16vp?entry=ttu&g_ep=EgoyMDI2MDIyNS4wIKXMDSoASAFQAw%3D%3D",https://tabelog.com/hokkaido/A0101/A010101/1065293/,2026-03-02,2026-03-02
